{
  "$schema": "https://json-schema.org/draft/2020-12/schema",
  "$id": "https://bago.local/schemas/bago.package.v1.schema.json",
  "title": "BAGO Package v1",
  "type": "object",
  "additionalProperties": false,
  "required": [
    "schema_version",
    "contract_version",
    "kind",
    "execution_mode",
    "id",
    "name",
    "version",
    "description",
    "author",
    "definition",
    "permissions",
    "compatibility",
    "dependencies",
    "files"
  ],
  "properties": {
    "schema_version": {
      "const": "1.0"
    },
    "contract_version": {
      "const": "bago.package/v1"
    },
    "kind": {
      "enum": [
        "capability",
        "pipeline"
      ]
    },
    "execution_mode": {
      "enum": [
        "declarative",
        "executable"
      ]
    },
    "id": {
      "type": "string",
      "pattern": "^[a-z0-9][a-z0-9._-]{2,63}$"
    },
    "name": {
      "type": "string",
      "minLength": 1,
      "maxLength": 120
    },
    "version": {
      "type": "string",
      "pattern": "^[0-9]+\\.[0-9]+\\.[0-9]+(?:[-+][a-zA-Z0-9._-]+)?$"
    },
    "description": {
      "type": "string",
      "minLength": 1,
      "maxLength": 500
    },
    "author": {
      "type": "string",
      "minLength": 1,
      "maxLength": 120
    },
    "definition": {
      "type": "string",
      "pattern": "^definitions/(capability|pipeline)\\.json$"
    },
    "entrypoint": {
      "type": "string",
      "pattern": "^runtime/(?!.*(?:^|/)\\.\\.(?:/|$))[^:]+\\.py$"
    },
    "permissions": {
      "type": "array",
      "uniqueItems": true,
      "items": {
        "enum": [
          "filesystem.read",
          "filesystem.write",
          "network",
          "process"
        ]
      }
    },
    "compatibility": {
      "type": "object"
    },
    "dependencies": {
      "type": "array",
      "items": {
        "type": "object",
        "additionalProperties": false,
        "required": [
          "id",
          "version"
        ],
        "properties": {
          "id": {
            "type": "string",
            "pattern": "^[a-z0-9][a-z0-9._-]{2,63}$"
          },
          "version": {
            "type": "string",
            "minLength": 1
          }
        }
      }
    },
    "files": {
      "type": "array",
      "minItems": 1,
      "items": {
        "type": "object",
        "additionalProperties": false,
        "required": [
          "path",
          "size",
          "sha256"
        ],
        "properties": {
          "path": {
            "type": "string",
            "pattern": "^(?!/)(?!.*(?:^|/)\\.\\.(?:/|$))(?!.*:).+$"
          },
          "size": {
            "type": "integer",
            "minimum": 0
          },
          "sha256": {
            "type": "string",
            "pattern": "^[0-9a-f]{64}$"
          }
        }
      }
    },
    "signature": {
      "type": "object",
      "additionalProperties": false,
      "required": [
        "algorithm",
        "key_id",
        "value"
      ],
      "properties": {
        "algorithm": {
          "type": "string",
          "minLength": 1
        },
        "key_id": {
          "type": "string",
          "minLength": 1
        },
        "value": {
          "type": "string",
          "contentEncoding": "base64"
        }
      }
    },
    "schedule_defaults": {
      "type": "array",
      "items": {
        "type": "object",
        "additionalProperties": false,
        "required": [
          "name",
          "schedule_type",
          "timezone"
        ],
        "properties": {
          "name": {
            "type": "string",
            "minLength": 1,
            "maxLength": 120
          },
          "schedule_type": {
            "enum": [
              "interval",
              "cron"
            ]
          },
          "interval_s": {
            "type": "integer",
            "minimum": 60
          },
          "cron_expr": {
            "type": "string",
            "minLength": 9
          },
          "timezone": {
            "type": "string",
            "minLength": 1
          }
        },
        "allOf": [
          {
            "if": {
              "properties": {
                "schedule_type": {
                  "const": "interval"
                }
              }
            },
            "then": {
              "required": [
                "interval_s"
              ]
            }
          },
          {
            "if": {
              "properties": {
                "schedule_type": {
                  "const": "cron"
                }
              }
            },
            "then": {
              "required": [
                "cron_expr"
              ]
            }
          }
        ]
      }
    }
  },
  "allOf": [
    {
      "if": {
        "properties": {
          "kind": {
            "const": "capability"
          }
        }
      },
      "then": {
        "properties": {
          "definition": {
            "const": "definitions/capability.json"
          }
        }
      }
    },
    {
      "if": {
        "properties": {
          "kind": {
            "const": "pipeline"
          }
        }
      },
      "then": {
        "properties": {
          "definition": {
            "const": "definitions/pipeline.json"
          }
        }
      }
    },
    {
      "if": {
        "properties": {
          "execution_mode": {
            "const": "executable"
          }
        }
      },
      "then": {
        "required": [
          "entrypoint"
        ]
      },
      "else": {
        "not": {
          "required": [
            "entrypoint"
          ]
        }
      }
    }
  ]
}
